{
  "schema_version": "1.1.0",
  "registry": "instruments",
  "updated": "2026-09-30",
  "notice": "Authoritative instrument-history record for the EMXplore Radio Astronomy project. Values carry evidence flags (documented / inferred / unknown) and point to entries in the 'sources' catalogue of datasets.json. Unknown facts are null by design; do not fill them without a citable source.",
  "instruments": [
    {
      "instrument_id": "fixed-transit-network",
      "name": "Fixed zenith transit telescopes (university network)",
      "aliases": [],
      "status": {
        "value": "historical",
        "evidence": "documented",
        "sources": [{"source_id": "src-project-decisions", "locator": "D4"}],
        "note": "Project decision: older systems remain historical. Whether individual stations are still operating is not recorded here."
      },
      "telescope_type": {
        "value": "Fixed parabolic reflector pointing at zenith; transit observation using Earth rotation",
        "evidence": "documented",
        "sources": [
          {"source_id": "src-site-project", "locator": "Pointing and Observation: Historical fixed system"},
          {"source_id": "src-site-index", "locator": "Published implementation reported in the 2025 IEEE paper"}
        ]
      },
      "pointing": {
        "capability": {"value": "fixed_zenith", "evidence": "documented", "sources": [{"source_id": "src-site-project", "locator": "Historical fixed system"}]},
        "limits": []
      },
      "observing_modes": [
        {
          "mode": "fixed_zenith_transit",
          "evidence": "documented",
          "sources": [{"source_id": "src-site-index", "locator": "Method: Fixed zenith transit-scan observations using Earth rotation"}]
        }
      ],
      "dish": {
        "diameter_m": {"value": 5, "unit": "m", "evidence": "documented", "sources": [{"source_id": "src-site-index", "locator": "Reflector"}]},
        "focal_ratio_f_over_d": {
          "value": 0.35,
          "unit": "dimensionless",
          "evidence": "documented",
          "sources": [{"source_id": "src-site-index", "locator": "Reflector: approximately f/D = 0.35"}],
          "note": "Stated as approximate."
        },
        "surface_construction": {"value": null, "evidence": "unknown", "note": "Not stated in the supplied material."},
        "feed": {"value": "Choke-horn feed", "evidence": "documented", "sources": [{"source_id": "src-site-index", "locator": "Feed"}]},
        "gain_dbi": {
          "value": 35,
          "unit": "dBi",
          "evidence": "documented",
          "sources": [{"source_id": "src-site-index", "locator": "Performance"}],
          "note": "Approximate value as reported from the IEEE 2025 paper."
        },
        "beam_fwhm_deg": {
          "value": 2.5,
          "unit": "deg",
          "evidence": "documented",
          "sources": [{"source_id": "src-site-index", "locator": "Performance"}],
          "note": "Approximate value as reported from the IEEE 2025 paper."
        }
      },
      "receiver": {
        "sdr": {
          "value": "Software-defined radio receiver chain (model not stated)",
          "evidence": "documented",
          "sources": [{"source_id": "src-site-index", "locator": "SDR stat tile"}]
        },
        "front_end": {
          "value": "Low-noise receiver chain (details not stated)",
          "evidence": "documented",
          "sources": [{"source_id": "src-site-project", "locator": "Radio signal chain"}]
        }
      },
      "site": {
        "description": {
          "value": "Deployed across Saudi universities; the IEEE 2025 paper reports replication across five universities at the published stage",
          "evidence": "documented",
          "sources": [{"source_id": "src-site-project", "locator": "University Deployment"}, {"source_id": "src-ieee-2025"}]
        }
      },
      "operational_period": {
        "start": null,
        "end": null,
        "evidence": "unknown",
        "note": "No commissioning or end dates in the supplied material. The project society was founded in 2016 (lecture slide 2), which is not a telescope date."
      },
      "relationships": [
        {
          "type": "predecessor_of",
          "target": "dish1",
          "evidence": "inferred",
          "sources": [{"source_id": "src-site-lecture", "locator": "slides 12-13 (motivation for a moving telescope)"}],
          "note": "The lecture presents the moving telescope as the next step after the fixed system; which physical dish came first is not documented."
        },
        {
          "type": "predecessor_of",
          "target": "dish222",
          "evidence": "inferred",
          "sources": [{"source_id": "src-site-lecture", "locator": "slides 12-17"}],
          "note": "Same basis as above."
        }
      ],
      "software_snapshots": [{"label": "Fixed-system acquisition/analysis software", "supplied": false, "evidence": "unknown", "note": "Not supplied."}],
      "calibration_epochs": [],
      "unresolved": [
        {"field": "operational_period", "question": "When were the fixed stations commissioned, and are any still operating?"},
        {"field": "site", "question": "Authoritative list of stations and institutions."},
        {
          "field": "data",
          "question": "Do source datasets from the fixed network (e.g. the KAU map on lecture slide 52) exist and can they be supplied?"
        },
        {"field": "receiver", "question": "SDR model and front-end used by the fixed stations."}
      ]
    },
    {
      "instrument_id": "dish1",
      "name": "DISH1",
      "aliases": [],
      "status": {
        "value": "historical",
        "evidence": "documented",
        "sources": [{"source_id": "src-project-decisions", "locator": "D4"}],
        "note": "Project decision. DISH1 is not a target of the new DISH222 software."
      },
      "telescope_type": {
        "value": "Motorised AZ/EL steerable dish controlled by a PC application and a Raspberry Pi motor loop",
        "evidence": "documented",
        "sources": [
          {
            "source_id": "src-legacy-dish1-v69",
            "locator": "window title (line 1056); motor-reverse options (lines 2509-2532); UDP command path (line ~8672)"
          }
        ]
      },
      "pointing": {
        "capability": {
          "value": "az_el_motorised",
          "evidence": "documented",
          "sources": [{"source_id": "src-legacy-dish1-v69", "locator": "motor reverse options, lines 2509-2532"}]
        },
        "limits": [
          {
            "value": "Elevation motor direction permanently reversed in software",
            "evidence": "documented",
            "sources": [{"source_id": "src-legacy-dish1-v69", "locator": "line 2526"}]
          }
        ]
      },
      "observing_modes": [
        {
          "mode": "raster_scan",
          "evidence": "inferred",
          "sources": [{"source_id": "src-legacy-dish1-v69"}],
          "note": "The V69 software contains the same raster/area/drift scan engines as V75. Whether DISH1 used them is not documented."
        }
      ],
      "dish": {
        "diameter_m": {"value": null, "unit": "m", "evidence": "unknown", "note": "Not stated in the supplied material."},
        "surface_construction": {"value": null, "evidence": "unknown"}
      },
      "receiver": {
        "sdr": {
          "value": null,
          "evidence": "unknown",
          "note": "V69 contains drivers for HackRF, RTL-SDR, PlutoSDR and USRP; the receiver actually fitted to DISH1 is not documented."
        },
        "supported_sdr_drivers": {
          "value": ["HackRF", "RTL-SDR", "PlutoSDR", "USRP"],
          "evidence": "documented",
          "sources": [{"source_id": "src-legacy-dish1-v69", "locator": "radio classes, lines ~369-900"}],
          "note": "Software capability, not a statement of installed hardware."
        }
      },
      "site": {"institution": {"value": null, "evidence": "unknown", "note": "Presumably the same site as DISH222, but not documented."}},
      "operational_period": {
        "start": null,
        "end": null,
        "evidence": "unknown",
        "note": "The V69 snapshot shows DISH1 was operated in parallel with DISH222 around Aug-Sep 2026 (see relationships). No dates are documented."
      },
      "relationships": [
        {
          "type": "operated_concurrently_with",
          "target": "dish222",
          "evidence": "documented",
          "sources": [{"source_id": "src-legacy-dish222-v75", "locator": "lines 8605-8609 (comment on command cross-talk between the two dishes' controllers)"}]
        },
        {
          "type": "predecessor_of",
          "target": "dish222",
          "evidence": "inferred",
          "sources": [{"source_id": "src-legacy-dish222-v75", "locator": "lines 8605-8609 ('SECOND dish')"}],
          "note": "Inferred from the numbering (DISH1 / second dish)."
        },
        {
          "type": "successor_of",
          "target": "fixed-transit-network",
          "evidence": "inferred",
          "sources": [{"source_id": "src-site-lecture", "locator": "slides 12-13"}],
          "note": "See fixed-transit-network relationships."
        }
      ],
      "software_snapshots": [
        {
          "label": "DISH1 legacy application V69",
          "supplied": true,
          "source_id": "src-legacy-dish1-v69",
          "evidence": "documented",
          "sources": [{"source_id": "src-legacy-dish1-v69"}],
          "note": "Legacy operational snapshot; shares ~98% of its code with DISH222 V75."
        }
      ],
      "calibration_epochs": [],
      "unresolved": [
        {"field": "dish", "question": "Diameter, surface and construction of DISH1."},
        {"field": "receiver", "question": "Which SDR and front-end DISH1 used."},
        {"field": "operational_period", "question": "Commissioning date and current status or fate of DISH1."},